name,transcription
Recording (37)_chunk_0006.wav,यस कम्पनीबाट उत्पादित तथा सङ्कालित सामानको विवरण यस प्रकार रहेका छन्
Recording (46)_chunk_0000.wav,म आज वाद विवाद प्रतियोगिताको विषयको विपक्षबाट बोल्दैछु स्थानीयकरणले स्थानीय भाषा
Recording (46)_chunk_0001.wav,क्षेत्र जाति प्रविधि सिप विचारको संरक्षण सम्वर्धन र विकासको कुरा गर्छ
Recording (46)_chunk_0002.wav,कुनै पनि भाषा संस्कृति जाति सम्पूर्ण मानव जातिका सम्पत्ति हुन्
Recording (46)_chunk_0003.wav,यी हाम्रा पुर्खाहरूको आविष्कार हुन् तिनमा मानव जातिका इतिहास सुरक्षित हुन्छ
Recording (46)_chunk_0004.wav,मान्छेले आफ्नो बाल्य परिवेशमा सिकेको भाषा सिप
Recording (46)_chunk_0005.wav,चालचलनहरू चाहेर पनि भुल्न सक्दैनन् र ती उसका लागि प्रिय हुन्छन्
Recording (46)_chunk_0006.wav,ती उसका जीवन पद्धति बनिसकेका हुन्छन् तिनमै उसको पहिचान बनिसकेको हुन्छ
Recording (46)_chunk_0007.wav,अनि आफ्नो सारा पहिचान बनिसकेको विषयको संरक्षण सम्वर्धन र विकास गर्नु उसको अधिकार र कर्व्य होइन र
Recording (46)_chunk_0008.wav,स्थानीयकरण जस्तै अधिकार र कर्तव्य त्यातक हो यसैले म स्थानीयकरणको पक्षपाती छु
Recording (49)_chunk_0000.wav,समयको एउटा लामो झरीपछिछि बल्ल घाम उदाएको छ बिहान भएको छ
Recording (49)_chunk_0001.wav,पानी थामिएको छ अब हामीले हाम्रो आरोहणको थालनी गर्नुपर्छ आस्थाको टुकी बाल्नुपर्छ
Recording (49)_chunk_0002.wav,अब हामीले उज्यालो छर्नुपर्छ मौसम पसन्तको छ अब हामीले गीत गुन्जउनुपर्छ
Recording (49)_chunk_0003.wav,फर्केका छन् गुराँसहरू अब हामीले मालाहरू उन्नुपर्छ
Recording (49)_chunk_0004.wav,नाच्दा नाच्दै चहाँ रोकेका थियो सोरठीको ताल त्यहीँबाट चाल्दै एउटा चालका तीन कोटी पाइला
Recording (63)_chunk_0000.wav,प्रकृतिमा जनताको जीवनमा र तिनका सुखदुखमा ठुलो ज्ञान हुन्छ तिनीहरूसँग भिचेर ज्ञानको उपार्जन गर्न सकिन्छ
Recording (63)_chunk_0001.wav,समाजका केटाकेटी बुढाबुढीसँग सम्पर्क राख्नाले र लेख बेसी गाउँघर
Recording (63)_chunk_0002.wav,खेतखलो मेला उत्सवमा घुम्ने फेर्ने गर्नाले पनि धेरै अनुभवी तथा पा
Recording (63)_chunk_0003.wav,पारखी बनाउँछ लोक साहित्यमा चलेको राम्रा राम्रा गीत उखान टुक्का लोककथा
Recording (63)_chunk_0004.wav,गाउँखाने कथा आदि सुन्ने बटुल्ने गर्नाले लोकसाहित्यको स सम्वर्धन र विकासमा मद्दत पनि हुन्छ
Recording (63)_chunk_0005.wav,कुनै चिज घटना वा दृश्य देख्दा उठेको विचार र मनमा आएको भावहरूलाई अभिव्यक्त गर्नुपर्छ
Recording (63)_chunk_0006.wav,यो वास्तविक अनुभूति यथार्थ पनि हुन्छ यसरी नै नयाँ चिज खोज्ने उत्सुकता र नयाँ चिज
Recording (63)_chunk_0007.wav,ग्रहण गर्ने संस्कार बसाउनुपर्र्छ पर्यवेक्षण र कल्पना पनि शक्ति बढाउनुपर्र्छ
Recording (64)_chunk_0000.wav,दुईजना बटुवा बगरमाथि हिँड्दै थिए खाम चर्किँदै थियो एकजनाले छाता ओड्यो
Recording (64)_chunk_0001.wav,अर्कासँग छाता थिएन तर उसले जुत्ता लगाएको थियो छाता हुनेसँग जुत्ता थिएन
Recording (64)_chunk_0002.wav,केही बेरपछिछि घामको रूपले बालुवा बेसरी तात्यो
Recording (64)_chunk_0003.wav,छाता हुनेको पैदाला फत्फती पुोल्न थाल्यो उसले आफ्नो सहयात्रीलाई भन्यो
Recording (64)_chunk_0004.wav,बालुवाले साह्रै पोल्न थाल्यो मलाई एकछिन तिम्रो जुत्ता देऊ म तिमीलाई मेरो छाता दिन्छु
Recording (64)_chunk_0005.wav,जुत्तावालाले आफ्नो जुत्ता फुकालेर साथीलाई दियो र छाता ओढेर खाली खुट्टा बालुवामाथि हिँड्न थाल्यो
Recording (64)_chunk_0006.wav,पाँच दस पाइला हिँड्दा हिँड्दै ऊ आतयो र भन्यो भो तिम्रो छाता तिमी नै ओड मेरो जुत्ता देऊ जुत्ता नभई म एक पाइलाई हिँड्न सक्दिन
Recording (64)_chunk_0007.wav,विचार छातावाला सङ्कटमा पर्यो र उसले भन्यो कस्तो अचम्म घामबरू सहन सकिन्छ
Recording (64)_chunk_0008.wav,तर त्यही घामले तातेको बालुवालाई सहन सकिन्न ती दुई बटुवा कुरा सुनिरहेको बालुवाले
Recording (64)_chunk_0009.wav,खमण्डले फुल्दै सूर्यलाई हेऱ्यो र चिचछ्यायो देख्यो मेरो शक्ति
Recording (64)_chunk_0010.wav,तिमी जति कडा भए पनि मानिसलाई पोल्न सक्दैनौ मैले मान्छेको सातो लिन सक्छु
Recording (64)_chunk_0011.wav,यो सुनेर सूर्य मुसुक्क हाँस्यो र बादलभित्र पस्यो बटुवाहरू
Recording (64)_chunk_0012.wav,ले चैनको सास फेरे केही बेरमै बालुवा सेलायो पटुवाहरू आरामसाथ अगाडि बढे
Recording (66)_chunk_0000.wav,खेतीका दुई तरिका छन् रासायनिक र जैविक रासायनिक मल तथा
Recording (66)_chunk_0001.wav,कीटनाशक विषादीको प्रयोग गरेर गरिने खेती रसायनिक खेती हो परम्परागत जैविक
Recording (66)_chunk_0002.wav,वस्तुमा मात्र ननिभर रहेर गरिने खेती जैविक हो
Recording (66)_chunk_0003.wav,जीवसँग सम्बन्धित कुरालाई जैविक भनिन्छ जो जन्मिन्छ बढ्छ र मर्छ अनि जसलाई
Recording (66)_chunk_0004.wav,बाँच्नका लागि खाना पानी र हावा चाहिन्छ त्यही नै जीव हो
Recording (66)_chunk_0005.wav,विषादी लगायतका हानिकारक तत्त्व प्रयोग नगरी गरिने खेती जैविक हो
Recording (66)_chunk_0006.wav,यसमा मानिस तथा जीवका लागि हानिकारक हुने तत्त्प्रयोग हुँदैन
Recording (66)_chunk_0007.wav,आफ्नै परिवेशमा पाइने वनस्पति जडीबुटी तथा अन्य वस्तुबाट जैविक खेतीका सामग्री तयार पारिन्छ यी सामग्री जीवनका लागि हानिकारक नभई लाभदायक हुन्छन्
Recording (66)_chunk_0008.wav,कृषियुगको आरम्भसँगै जैविक खेतीको सुरुवात भएको हो
Recording (66)_chunk_0009.wav,उद्योगधन्दाको विकाससँगै जनसङ्ख्याको ठूलो हिस्सा कृषिबाट विमुख भयो
Recording (66)_chunk_0010.wav,थोरैले काम गरेर धेरैलाई पाल्नुपर्र्ने भयो यसैले थोरै जमिनमा धेरै उत्पादन गर्ने उपायका रूपमा
Recording (66)_chunk_0011.wav,रासायनिक मलमा बाली बिरुवाका लागि अधिक मात्रामा चाहिने नाइट्रोजन फस्फरस
Recording (66)_chunk_0012.wav,जस्ता खाद्यतत्त्वहरू मिश्रण गरिएको उत्पादन बढ्न थाल्यो
Recording (66)_chunk_0013.wav,यसै गररी बीसौँ शताब्दीदेखि बाली नालीमा लाग्ने
Recording (66)_chunk_0014.wav,नियन्त्रण गर्न विषाधीको पनि प्रयोग हुन थाल्यो रासायनिक मलबाट उत्पादन बढ्ने
Recording (66)_chunk_0015.wav,विषादीको प्रयोगबाट रोग र किरा नियन्त्रण हुने भएपछि थोरै जमिनमा धेरै उत्पादन हुनु स्वाभाविक हो
Recording (66)_chunk_0016.wav,यसरी थोरै मेहनतबाट धेरै उब्जनी दिन सकेकाले रासायनिक खेती चाँडै लोकप्रिय हुन थाल्यो
Recording (66)_chunk_0017.wav,रासायनिक खेतीमा यी फाइदाहरू भएर पनि यसका बेफाइदा पनि देखििन
Recording (66)_chunk_0018.wav,यसले गर्दा रासायनिक खेतीका विषयमा अनुसन्धान र अध्ययन गर्नुपर्ने अवस्था आयो
Recording (66)_chunk_0019.wav,हुन थालेका अध्ययनले यसको विकल्पको खोजी गर्नुपर्ने तथ्यलाई प्रस्तुत गर्यो
Recording (66)_chunk_0020.wav,पृथ्वीको पर्यावरण मानव स्वास्थ्य र वानस्पतिक चक्रमा आएको सङ्कटले पनि रासायनिक खेती प्रतिकूल हुन्छ भन्ने निष्कर्ष प्रस्तुत भयो
Recording (68)_chunk_0000.wav,रासायनिक मलले माटोको अम्लयपन बढाएर प्राकृतिक बनावट बिगार्छ जैविक तत्त्वको कमी हुँदा जमिन मरूभूमिमा परिणत हुन बेर लाग्दैन
Recording (68)_chunk_0001.wav,बाली बिरुवालाई सखा पार्ने किट पतङ्गलाई कतिपय किरा फट्याङ्ग्रा च
Recording (68)_chunk_0002.wav,चराचुरुङ्गीहरूले खाएर थपाएर सहयोग पुऱ्याइरहेका हुन्छन् त्यस्तै मौरी बारुला पुतली
Recording (68)_chunk_0003.wav,झिङ्गाा लगायतका किटपतङ्ले बालीको पराग प्रक्रियामा
Recording (68)_chunk_0004.wav,सहयोग पुर्याई उत्पादन बढाउँछ रासायनिक खेतीले बाली बिरुवाको मित्रलाई पनि असर गर्दछ
Recording (68)_chunk_0005.wav,अर्कातिर शत्रुक्रिया किराहरूको क्षमता बढ्छ र कडाभन्दा कडा
Recording (68)_chunk_0006.wav,खालका विषादीको प्रयोग गर्नुपर्ने अवस्था आउँछ विषादीको बढ्दो प्रयोगले मानव स्वास्थ्यमा गम्भीर असर गर्छ यसले क्यान्सर उच्च रक्तचाप
Recording (68)_chunk_0007.wav,कलेजो र फोक्सो बिग्रिने खालका रोगहरूलाई निम्त्याउँछ यसरी रासायनिक खेतीले मानव स्वास्थ्य पर्यावरणीय सन्तुलन र
Recording (7)_chunk_0000.wav,वाक्यमा प्रयुक्त पदको निश्चित क्रम हुन्छ कुनै पनि भाषामा नाम सर्वनाम विशेषण क्रिया
Recording (7)_chunk_0001.wav,क्रियाविशेषण आदि शब्द वाक्यमा प्रयोग भइसकेपछि तिनलाई पद भनिन्छ
Recording (7)_chunk_0002.wav,भाषामा धेरै किसिमका पद भए पनि तिनले वाक्यमा प्रयुक्त हुँदा सम्पन्न गर्ने मुख्य कार्यका आधारमा कर्ता
Recording (7)_chunk_0003.wav,कर्म र क्रिया गरी तीन प्रकारमा राखेर अध्ययन गरिन्छ संसारका प्रत्येक भाषाका वाक्यमा प्रयुक्तकर्ता कर्म क्रियाको निश्चित क्रम हुन्छ
Recording (7)_chunk_0004.wav,यसैले पदक्रमका आधारमा संसारका भाषाको वर्गीकरण गर्न सकिन्छ र गरिएको पनि छ
Recording (7)_chunk_0005.wav,पदक्रमका आधारमा संसारमा छ किसिमका भाषा रहेका छन् नेपाली मैथली
Recording (7)_chunk_0006.wav,संस्कृत हिन्दी जापानी कोरियन मङ्गोलियन आदि भाषाकर्ता क्रम क्रियाको क्रम भएका भाषा हुन्
Recording (70)_chunk_0000.wav,पृथ्वीमा रहेका सबै पशुपक्षी कीटपतङ्ग र वनस्पतिहरू आपसमा निर्भर भएकाले
Recording (70)_chunk_0001.wav,पर्यावरणीय सन्तुलनका लागि यी सबैको आवश्यकता छ खेतीपाती शत्रु किरा फट्याङ्ग्रा
Recording (70)_chunk_0002.wav,सुलसुले मुसा खरायो तुम्सी बाँदर समेत पर्यावरणीय सन्तुलनका लागि आवश्यक छन्
Recording (70)_chunk_0003.wav,यस्ता जीवलाई मार्ने होइन थपाउने र भगाउने उपाय खोज्नुपर्छ
Recording (70)_chunk_0004.wav,जैविक खेती यही मान्यतामा आधारित छ जैविक खेतीले वातावरणीय सन्तुलन
Recording (70)_chunk_0005.wav,मिलाउनका साथै मानवलगायत पृथ्वीमा रहेका सबैको जीवन बचाउने काम गर्छ
Recording (74)_chunk_0000.wav,जैविक खेतीमा प्राङ्गारिक मलको प्रयोग गरिन्छ प्राङ्गारिक मलले वातावरणलाई कुनै असर गर्दैन
Recording (74)_chunk_0001.wav,यसबाट माटो पानी र वायु प्रदूषणलाई घटाउन सहयोग मिल्दछ
Recording (74)_chunk_0002.wav,यस्तो खेतीले माटोको उर्वराशक्ति कायम लाग्छ र मानिस तथा पशुप
Recording (74)_chunk_0003.wav,छबाट निस्कने फोहोर मैलाको व्यवस्थापनमा सहयोग गर्छ यसले ठूलो धनराशि खर्चेर रासायनिक
Recording (74)_chunk_0004.wav,िक मल उत्पादन गर्नुभन्दा गाउँसहरमा खरे जाने वस्तु र वनस्पतिबाट सामान्य तरिकाले प्राङ्गारिक मल बनाउनु धेरै श्रेयस्कर छ
Recording (74)_chunk_0005.wav,यसले सहर सफा राख्नु मल उत्पादनको खर्च घटाउन र वातावरण जोगाउन सहयोग गर्छ
Recording (74)_chunk_0006.wav,जैविक विधिबाट रोग तथा किरा नियन्त्रण गर्ने अनेकौँ उपायहरू छन्
Recording (74)_chunk_0007.wav,राम्ररी खनजोत गरी समयमा बाली लगाउँदा र उचित मलको प्रयोग गर्दा बाली बिरुवाको प्रतिरोधक क्ष
Recording (74)_chunk_0008.wav,क्षमता बढ्छ यसपल् बाल बिरुवामा रोग र किराहरूको आक्रमण
Recording (74)_chunk_0009.wav,मा कमी आउँछ कतिपय किराहरूलाई हातले टिपेर चालीको प्रयोग गरेर बत्ती बिलीी दिएर दिएर र
Recording (74)_chunk_0010.wav,मित्र किराको उत्पादन गरेर पनि हानिकारक किरा नियन्त्रण गर्न सकिन्छ तितो पिरो अमिलो
Recording (74)_chunk_0011.wav,तर आदि वनस्पतिको झोल र थुलो प्रयोग गर्नाले अधिकांश किरा रक किटाणुलाई भगाउनु र नियन्त्रण गर्न सकिन्छ
Recording (74)_chunk_0012.wav,यस्ता वनस्पतिमा तितेपाती निम जस्तो पर्दछन्
Recording (75)_chunk_0000.wav,जैविक खेती केवल निर्वाहमुखी न मात्र नभई त्यसको व्यावसायीकरण र आधुनिकीकरण हुनुपर्छ यसका लागि सर्वप्रथम माटोको परीक्षण आवश्यक हुन्छ
Recording (75)_chunk_0001.wav,कुन माटोमा के कस्तो तत्त्व छन् के कस्तो तत्त्व अभाव छ
Recording (75)_chunk_0002.wav,कुन माटो कुन बालीका लागि उपयुक्त छ आदि कुराको जानकारी लिएर माटोको प्र
Recording (75)_chunk_0003.wav,प्रकृतिअनुसार जैविक खेती लगाउन सकिन्छ माटामा
Recording (75)_chunk_0004.wav,विधिबाटै आपूर्ति गर्न सकिन्छ उपयुक्त हावापानी उपयुक्त मौसम आवश्यक मलको प्रयोग
Recording (75)_chunk_0005.wav,सिँचाइ व्यवस्था उपयुक्त बालिचक्र आदि मिलाएर खेती गर्न आवश्यक हुन्छ
Recording (75)_chunk_0006.wav,यसो गर्दा जैविक विधिबाट पनि पर्याप्त उत्पादन गर्न सकिन्छ
Recording (76)_chunk_0000.wav,नेपालको प्राकृतिक भौगोलिक सामाजिक सांस्कृतिक पर्यावरण जैविक खेतीको लागि अनुकूल छ
Recording (76)_chunk_0001.wav,प्रशस्त मात्रामा जङ्गल चरण सुविधा र पानीको स्रोत भएकाले नेपालमा व्यावसायिक रूपमा
Recording (76)_chunk_0002.wav,रूपमा गाई भैँसी बाख्रा भेडा कुखुरा सुँगुर माछा जस्ता पशुपक्षी पाल्न सकिन्छ
Recording (76)_chunk_0003.wav,यसबाट पर्याप्त मात्रामा दुध दही घिउ न मह चिज आदिको उत्पादनका साथै प्रा प्रा
Recording (76)_chunk_0004.wav,प्राङ्गारिक मल उत्पादन हुन्छ पानीको स्रोत उपयोग गरेर सिँचाइको राम्रो व्यवस्था गर्न सकिन्छ
Recording (76)_chunk_0005.wav,अब नेपाल गाउँ गाउँसम्म सडक यातायात पुग्न थालेको छ
Recording (76)_chunk_0006.wav,उत्पादित वस्तुलाई बजारसम्म पुर्याउन सहज बन्दैछ जैविक खाद्यवस्तु देशभित्र र विदेशमा पनि महँगो मूल्यमा सजिलै बिक्री हुन्छ
Recording (76)_chunk_0007.wav,वर्षेनी अरौँगौँ रुपियाँको खाद्य पदार्थ आयात गर्नु अहिले नेपालको बाध्यता बनेको छ
Recording (76)_chunk_0008.wav,निर्वाहमुखी र परम्परागत खेतीका कारण यस्तो भएको हो जैविक खेतीलाई वृहत अ
Recording (76)_chunk_0009.wav,त अभियानका रूपमा अगाडि बढाउन सके नेपाल खाद मन्न
Recording (79)_chunk_0000.wav,नेपालमा खेतीलाई व्यवसायका रूपमा बुझ्न र ग्रहण गर्न सकिएको छैन संसार जतिसुकै अगाडि बढे पनि
Recording (79)_chunk_0001.wav,मानिसको प्राण बचाउने खानेकुरा खेतीबाटै आउँछ भन्ने कुरा हामीले मनन गर्न सकेको छैनौँ
