name,transcription
Recording (100)_chunk_0000.wav,हामीलाई बोलाउँछन् हिमचुली राम्रा उकालीमा उचालिन्छन् हल्का पाइला हाम्रा उकालीको चिसो पानी
Recording (100)_chunk_0001.wav,अँजुलीले खाउला देउरालीको बिसौनीमा सुसेरीले गाउला
Recording (100)_chunk_0002.wav,भनभित्र डढुङ्गामाथि गाउँलन् गठालिनी गाईलाई बोलाउलन् लाला उदी नानी
Recording (100)_chunk_0003.wav,उनी सोतेन हामीलाई कहाँ जाने दाई भन्नुपर्र्ला हिमालको बुटी खोज्नलाई
Recording (100)_chunk_0004.wav,दोरिेटोमा कस्तुरीले तिरिन् च्यापी हेर्लान् पातैपात चरा नाच्ने पातलले घेर्लान्
Recording (100)_chunk_0005.wav,टाकुरामा कुहिराको दौडादौडी होला
Recording (100)_chunk_0006.wav,लेखदेखि इन्द्रणीलाई बनबेसी छोला भेडाचर्लान् निगाालाको टुप्पो हिलाएर
Recording (100)_chunk_0007.wav,चर्मिन सर्लाल चमेरका झुपी छझुलाएर
Recording (100)_chunk_0008.wav,मग मग बुकी फुलको बासनाले ढालला
Recording (100)_chunk_0009.wav,उत्तरमा झुक्ने धुपी उत्तरैमा ढाक्ला नागियुमा
Recording (104)_chunk_0000.wav,कुनै पनि देशको मुख्य परिचायक तत्त्व भनेको संस्कृति हो नेपाल पनि आफ्नै संस्कृतिका कारण विश्वमा सबै
Recording (104)_chunk_0001.wav,सबैतिर चिनिएको छ नेपाल बहुजातीय र बहु सांस्कृतिक देश हो नेपालमा बसोबास गर्न
Recording (104)_chunk_0002.wav,सबै जातिका आ आफ्नै संस्कृति छन् खस नेवार राई गुरुङ तामाङ लगायत
Recording (104)_chunk_0003.wav,सबै जातिका आआ आफ्नै संस्कृति छन् सर्वप्राचीन वैदिक संस्कृतिको आधारभूमि र संसारमै लोकप्रिय
Recording (104)_chunk_0004.wav,लोकप्रिय बनेको बौद्ध संस्कृतिको उद्गम स्थल नेपाल नै हो
Recording (104)_chunk_0005.wav,नेपाली संस्कृतिमा म मात्र खााउँ म मात्र लाउँ स्वार्थी भावना नभई सबै निरोगी र
Recording (104)_chunk_0006.wav,र खुसी हुन् अनि सम्मानपूर्वक बाँच्न पाउन् भन्ने भाव रहेको छ नेपालमा रहेको सबै जातिमा
Recording (104)_chunk_0007.wav,जातिका संस्कृतिको साझा विशेषता चाहिँ प्राकृतिलाई कुनै न कुनै रूपमा पूजा गर्नु हो
Recording (104)_chunk_0008.wav,यस्तै आमाबुवा पाहुना र गुरुलाई देवता मान्ने संस्कृति नेपालको साझा संस्कृति हो यसरी
Recording (104)_chunk_0009.wav,नेपाली संस्कृतिका उत्कृष्ट विशेषता हुँदाहुँदै पनि यसमा केही विकृति पनि देखिन थालेका छन्
Recording (104)_chunk_0010.wav,यस्ता विकृतिबाट मानिसमा ठगाह मिचाह हेपाह चुसाह र लु
Recording (104)_chunk_0011.wav,लुटाहा प्रवृत्तिको विकास हुन्छ यस्ता प्रवृत्ति भएको मान्छे निष्क्रिय हिंसक
Recording (104)_chunk_0012.wav,पियक्कर मान्छेले आफूलाई जतिसुकै बुछक्कर थाने पनि तिनीहरू प्राय
Recording (104)_chunk_0013.wav,झुलक्कड नै हुने भएझै विकृतिमा रमाउने मानिस पनि समाजमा
Recording (104)_chunk_0014.wav,यस्ता व्यक्तिमध्ये कोही कोही आर्थिक रूपमा समृद्ध र सुख होलान् तर विकृतिमा रमाउने हुन्छ सधैँ दुगृत
Recording (104)_chunk_0015.wav,भने झै अरूलाई ठगेर एवम् दुःख दिएर कमाएको धनसम्पत्ति विविद कारणवश नष्ट हुन्छ
Recording (104)_chunk_0016.wav,यिनीहरू फिरन्दे र मगन्ते जीवन जिउन बाध्य हुन्छन् निष्क्रिय जीवन जिउनको त प्र
Recording (104)_chunk_0017.wav,प्रकृतिको सम्भावना नै रह रहँदैन यसैले सांस्कृतिक उन्नतिको सूचक हो भने विकृति अवनतिकारक हो
Recording (11)_chunk_0000.wav,थाङ्गा कलाको उत्कृष्ट रूप त हुँदै हो साथसाथै यो सुन्दर प्रविधि पनि हो
Recording (11)_chunk_0001.wav,यसका लागि सर्वप्रथम सरेस बनाइन्छ सरेस भनेको जनावरको छाला पानीमा उमालेर बनाइएको चिप्लो बाक्लो झोल हो
Recording (11)_chunk_0002.wav,त्यसपछि सरसमा कमेरो माटो हालेर पकाइन्छ र एक प्रकारको गम जस्तो माड तयार पारिन्छ
Recording (11)_chunk_0003.wav,त्यो माडलाई फ्रेममा तन्काइएको सेतो कटन वा सिल्क कपडामा दलिन्छ र सुकाइन्छ
Recording (11)_chunk_0004.wav,यसरी बनाइएको कपडालाई तन्काएर तीन चार पटकसम्म चिल्लो ढुङ्गा वा शङ्खले घोटिन्छ
Recording (11)_chunk_0005.wav,यसो गर्दा कपडा चिल्लो हुन्छ र चित्र कोर्न योग्य बन्छ
Recording (12)_chunk_0000.wav,थाङ्गा कोर्ने काममा पनि विभिन्न चरण र प्रक्रिया हुन्छन् सर्वप्रथम खाइबाले सिसा कलमले चित्र स्केच गर्छन्
Recording (12)_chunk_0001.wav,स्केच गरिएको चित्रलाई तलमाथि नपरोस् भन्ने उद्देश्यले ट्रेसिङ पेपरमा उतारिन्छ त्यसपछि स्केच गरिएको चित्रमा रङ भर्ने काम हुन्छ
Recording (12)_chunk_0002.wav,रङ भर्ने कामपछि चित्रलाई स्पष्ट देखिने गरी लाइन कोर्ने काम गरिन्छ
Recording (12)_chunk_0003.wav,त्यसपछि सुन्दलिन्छ थाङ्कामा चौबिस क्यारेटको गुणस्तरीय सुन्दल्ने चलन छ
Recording (12)_chunk_0004.wav,यसका लागि सर्वप्रथम सुनलाई सरेसँग मिलाएर पानीमा घोलिन्छ
Recording (12)_chunk_0005.wav,यसरी घोल्दा पानी माथि हुन्छ र पग्लेको सुन तल जान्छ पग्लिएको सुनको लेपलाई
Recording (14)_chunk_0000.wav,त्यही बेला नेपाल र तिब्बतका बीचमा स्वतन्त्र रूपमा आवतजावत हुन्थ्यो सोझो व्यापारिक सम्बन्ध थियो
Recording (14)_chunk_0001.wav,नेपालीहरू तिब्बतमा व्यापार व्यवसाय मात्र होइन घर गृहस्थी गरेर बस्थे
Recording (14)_chunk_0002.wav,त्यतिबेला नेपाल तथा तिब्बतका बौद्ध मार्गहरूमा कपडामा लेखिएको देवी देवताको पूजा गर्ने चलन थियो
Recording (14)_chunk_0003.wav,पहिले सामान्य कपडामा सामान्य रूपमा चित्र लेख्ने गरिन्थ्यो पछि त्यसलाई टिकाउ र कलात्मक बनाउन थालियो
Recording (14)_chunk_0004.wav,तिब्बत र चिनमा नेपाली कलाकारहरूलाई झिकाएरै कला सिर्जना गर्न लगाइयो
Recording (14)_chunk_0005.wav,त्यसैले नेपाली कलाकारहरूले तिब्बत र चिनमै गएर पनि थाङ्का लेख्न थाले
Recording (14)_chunk_0006.wav,पछिल्लो समयमा थाङ्का नेपाल तिब्बत र भुटानसहितको हिमाली बौद्धमार्गीहरूको पहिचान बनिएको छ
Recording (16)_chunk_0000.wav,थाङ्का कलाप्रेमीहरूका लागि उत्कृष्ट कलाकृत बौद्धमार्गीहरूका लागि आस्थाको प्रतीक र शान्तिप्रेमीका लागि शान्तिको प्रतीक हो
Recording (16)_chunk_0001.wav,गुम्बाहरूमा र घर घरमा समेत थाङ्कालाई सजाइन्छ र पुजिन्छ
Recording (16)_chunk_0002.wav,लामा बौद्ध समुदायमा त हरेक मृतकका नाममा एउटा थाङ्का अनिवार्य रूपमा चाहिन्छ
Recording (16)_chunk_0003.wav,मान्छे मर्दा उसको इष्ट देवताअनुसार अलग अलग थाङका चाहिन्छ मृत
Recording (16)_chunk_0004.wav,ितकक नाममा थाङ्का घरमा पूजा गरिन्छ वा गुम्बाहरूमा चढाइन्छ
Recording (16)_chunk_0005.wav,त्यस्तो त थाङ्गा पौधमार्कीहरूले मात्र होइन अरूले पनि किन्छन्
Recording (16)_chunk_0006.wav,कला मन पराउनेहरू सुन्दर कलाका रूपमा यसलाई किन्छन् नेपाल घुम्न आउने कतिपय प पर्यटकहरू
Recording (16)_chunk_0007.wav,बुद्ध जन्मिएको भूमिको चिनोको रूपमा पनि थाङ्कालाई किन्ने गरेका छन्
Recording (16)_chunk_0008.wav,पछिल्लो समयमा थाङ्गाको कला र प्रविधि प्रयोग गरेर
Recording (16)_chunk_0009.wav,अरू धर्मका देवी देवताहरूको चित्रहरू पनि बनाउन थालिएको छ
Recording (17)_chunk_0000.wav,नेपालमा हरेक जाति समुदायका आफ्ना मौलिक सिप प्रविधि र उत्पादन छन् हामीसँग धातु
Recording (17)_chunk_0001.wav,काठ न बाँस माटो पात कपास आदिका सामान बनाउने आफ्नै प्रकारको सिप र प्रविधि थियो अझै छ
Recording (17)_chunk_0002.wav,हाम्रा आफ्नै मौलिकतामा राडीपाखी गलैँचा कागज कपडा फाँडाकुँडा मूर्ति आदिको उत्पादन हुने गरिएको पाइन्छ
Recording (17)_chunk_0003.wav,विश्वव्यापीकरणको बढ्दो प्रभावसँगै आयातीत उत्पादनको बढ्दो प्रयोगले हाम्रा मौलिक उत्पादनहरू सङ्कटमा पर्दै गएका छन्
Recording (17)_chunk_0004.wav,यसैले हामीले हाम्रा मौलिक उत्पादनलाई प्रवर्धन गर्नु आवश्यक छ थाङ्गा हाम्रा
Recording (19)_chunk_0000.wav,धेरै मानिसहरू थाङका व्यवसायमा आश्रित छन् आजभोलि अरू जातिका मानिसहरू पनि यसमा संलग्न हुन थालेका छन्
Recording (19)_chunk_0001.wav,थाङ्का व्यवसायमा अपाङ्गता भएका व्यक्तिहरू समेत सहभागी हुन थालेका छन्
Recording (19)_chunk_0002.wav,वर्षेनी अरौबौँ रुपैयाँको थाङ्का विदेशमा बिक्री हुन्छ संसारमा थाङकाको साथसाथै बुद्धसम्बन्धी मूर्तिहरूको पनि उत्तिकै माग छ
Recording (19)_chunk_0003.wav,कतिपय बौद्धमार्गीहरू थाङ्गाको साथसाथै बुद्धका मूर्तिहरू पनि लैजान्छन् नेपालमा बुद्ध सम्बन्धी मूर्तिको उत्पादन पनि हुने गरेको छ
Recording (19)_chunk_0004.wav,बुद्ध र भिगुटीको जन्मथलो कतिपय बुद्ध गुरुहरूको धर्म र ज्ञानथलोको रूपमा रहेको नेपाल
Recording (19)_chunk_0005.wav,यसर्थ थाङ्का र मूर्तिलाई सँगसँगै प्रवर्तन गर्ने गर्न सके नेपाल बुद्ध सम्बन्धी सामग्री उत्पाद
Recording (19)_chunk_0006.wav,उत्पादन र बिक्री गर्ने संसारकै प्रमुख राष्ट्र बन्न सक्छ
Recording (20)_chunk_0000.wav,हरियालीले भरिपूर्ण गुल्मी जिल्लाको दिगाम गाउँ प्राचीनकालदेखि नै स्वर्ग जस्तै साँच्चै सुन्दर थियो
Recording (20)_chunk_0001.wav,यही गाउँको रातामाटा भन्ने ठाउँमा एउटा आकर्षक घर थियो त्यस घरमा
Recording (20)_chunk_0002.wav,पुराना खालका सामानहरू र आधुनिक कालका सामानहरू प्रशस्तै थिए
Recording (20)_chunk_0003.wav,त्यस घरमा ढिकी जाँतो माना पाथी आदि पुराना सामानहरूले घरको शोभा बढाएका थिए ती सामानहरू ठाउँ ठाउँमा मिलाएर राखिएका थिए
Recording (20)_chunk_0004.wav,गाउँ निकै विकसित हुँदै थियो किसानहरू उखु खेती गर्दै थिए
Recording (20)_chunk_0005.wav,खेतीबारीमा अदुवा लगाउँदै थिए उनीहरूले फलफुल खेती पनि गरेका थिए र आफ्नो आम्दानी पनि बढाएका थिए
Recording (20)_chunk_0006.wav,उनीहरूले यस घरलाई गाउँकै सङ्ग्रहालय बनाउन चाहेका थिए किनकि मानिसहरू त्यो घर देखेर निकै प्रसन्न हुन्थे
Recording (20)_chunk_0007.wav,त्यस घरमा दुईजना बुढाबुढी बस्थे तिनीहरू मिलिचुली खेतबारी काम गर्थे
Recording (20)_chunk_0008.wav,म पनि यही घरमा जन्मेँ मिठा मिठा फलफुल खाएँ यही गाउँमा खेलि खेलि हुर्केँ
Recording (22)_chunk_0000.wav,टेलिभिजनमा समाचार आउँदै थियो विद्वानहरूले आफ्ना विचार राख्दै थिए
Recording (22)_chunk_0001.wav,अब नेपालको विकासको गति लिँदैछ देशभर उद्योगहरू खुल्दैछन् कृषिमा नयाँ क्रान्ति आउँदैछ
Recording (22)_chunk_0002.wav,युवा शक्ति अगाडि बढ्दैछन् सबै नागरिकहरू उत्साहित भएर काममा लाग्दैछन्
Recording (22)_chunk_0003.wav,देश सङ्घीयतामा जाँदैछ भूगोलका रेखाहरू कोरिँदैछन्
Recording (22)_chunk_0004.wav,जनताका आकाङक्षाहरू पूरा हुँदैछन् ठाउँ ठाउँमा बिजुली निकालिँदैछ
Recording (22)_chunk_0005.wav,राजनीतिक परिवर्तनपछि नेपाल नयाँ युगम प्रमा प्रवेश गर्दै थियो
Recording (22)_chunk_0006.wav,नेपालीहरू रमाउँदै थिए नेपाल नवीन सोच र इच्छा शक्तिका साथ अगाडि बढ्दै थियो
Recording (26)_chunk_0000.wav,वर्षा आनन्द प्राप्तिको समय हो यो समयमा रस र धरतीको मिलन हुन्छ
Recording (26)_chunk_0001.wav,धरतीमा रहेका सम्पूर्ण वनस्पति रुख बिरुवा प्राणी आदिले जीवनका लागि ऊर्जा प्राप्त गर्छन्
Recording (26)_chunk_0002.wav,मानवको मनमा खेतमा धान रोपेर मङ्सिरमा अन्न ऐश्वर्या ल्याई यस धरतीमा आफू बाँचेर अरूलाई पनि बचाउने कल्पनाको बाढी आउँछ
Recording (26)_chunk_0003.wav,आकाश गीत सङ्गीतले युक्त हुन्छ धरतीका सम्पूर्ण प्राणीहरू सुखरूपी समुद्रमा पौडखिन्
Recording (28)_chunk_0000.wav,आधुनिक युगमा मानवीय आवश्यकता पूर्ति गर्न वैज्ञानिकहरूले नयाँ नयाँ कुराको अनुसन्धान गरेका छन्
Recording (28)_chunk_0001.wav,गाउँलेहरू सहरया भएका छन् तर आफ्नो कर्तव्य बिर्सन थालेका छन्
Recording (28)_chunk_0002.wav,सहरमा औद्योगिक क्षेत्रको विकास मात्र होइन दानवीय प्रवृति पनि देखा परिएको छ
Recording (28)_chunk_0003.wav,विज्ञानले विविध क्षेत्रमा चमत्कारिक परिवर्तन गरे तापनि मानवता हराएको छ
Recording (28)_chunk_0004.wav,शिक्षित नेपालीहरू पनि नैतिक र चरित्रवान बन्न सकेका छैनन्
Recording (28)_chunk_0005.wav,शैक्षिक बेरोजगारी बढेको छ गरिबीले सताएको छ
Recording (28)_chunk_0006.wav,सहरको यान्त्रिकताभित्र मानिसहरू दयालु र मायालु बन्न सकेका छैनन्
Recording (28)_chunk_0007.wav,बसमा चढ्दा पनि होसियार बन्नुपर्छ नत्र आफ्नो मोबाइलसमेत चोरी हुनसक्छ
Recording (28)_chunk_0008.wav,सहरमा जङ्गली जनावरको डर त छैन तापनि रक्षाह मिचाह र नशालुको डर हुन्छ
Recording (28)_chunk_0009.wav,छापाली गोर्खाली पाल्पाली गुल्मेली र पर्वत लगायत सबै नेपालीहरू मिल्नुपर्छ
Recording (34)_chunk_0000.wav,गाउँ बस्तीका मानिसलाई बाहिरतिर घुम्न त्यति धेरै अवसर हुँदैन खेत बारी कुलो वन घास
Recording (34)_chunk_0001.wav,दाउरा वरपर तलमाथि गर्दै उनीहरूको समय बित्छ
Recording (34)_chunk_0002.wav,हिउँद वर्षा जाडो गर्मी हावा हुरी बतास बिहान बेलुका दिउँसो राति आदि सबै
Recording (34)_chunk_0003.wav,सबै याम समय मौसममा काम गर्नुपर्छ उनीहरूले कहिले काहीँ जान पाउने ठाउँ भनेको नजिकैको हाटबजार हो
Recording (34)_chunk_0004.wav,यसबाहेक उनीहरू कहिलेकाहीँ गाउँमा हुने बिहेबटुलो चाडपर्व जात्रा मेला उत्सव आदिमा जान पाउँछन्
Recording (37)_chunk_0000.wav,यस कम्पनीबाट उत्पादित तथा सङ्कलित वस्तुको बिक्री विवरण गर्ने र दुई कम्पनीका बीचमा सहकार्य गर्ने भनी
Recording (37)_chunk_0001.wav,त्यस कम्पनीले राखेको प्रस्तावलाई यो कम्पनी सहरर्ष स्वीकार गर्छ
Recording (37)_chunk_0002.wav,यस कम्पनीले विगतका दिनमा अन्य धेरै कम्पनीसँग सहकार्य गरिसकेको छ र त्यसबाट दुवै पक्ष लाभावित पनि भएका छन्
Recording (37)_chunk_0003.wav,त्यसैले आगामी दिनमा अन्य कम्पनीसँग झैँ त्यस कम्पनीसँग पनि सुमधुर वातावरणमा सहयोग आदान प
Recording (37)_chunk_0004.wav,आदान प्रदान हुने अपेक्षाका साथ यथाशीघ्र सम्झौता गरी काम अघि बढाउन समेत यो कम्पनी अनुरोध गर्छ
Recording (37)_chunk_0005.wav,यस कम्पनीबाट उपलब्ध हुने वस्तुहरूको विस्तृत विवरण र मूल्य सूची हाम्रो वेबसाइटमा उपलब्ध छ
