name,transcription
3/20260223 172436.wav,फलोअपको लागि अर्को हप्ता आउनुहोस्
3/20260223 172441.wav,क्याबन खाली छ कि छैन बुझिदिन्छु
3/20260223 172453.wav,आज आँखा जाँच गर्ने शिविर क्याम्प छ
3/20260223 172512.wav,दाँतको डाक्टर डेन्टिस्ट तीन बजे आउनुहुन्छ
3/20260223 172518.wav,रगतको समूह ब्लड ग्रुप कुन हो
3/20260223 172523.wav,पिसाब जाँचको लागि नमुना स्याम्पल यहाँ राख्नुहोस्
3/20260223 172530.wav,इमर्जेन्सी केसलाई पहिलो प्राथमिकता दिइन्छ
3/20260223 172535.wav,फिजियोथेरापी सेन्टर पछाडि छ
3/20260223 172543.wav,बिरामीलाई बाहिरको खाना नखुवाउनुहोला
3/20260223 172548.wav,आइसियूमा भेट्न मनाही छ
3/20260223 172553.wav,कृपया सरसफाइमा ध्यान दिनुहोस्
3/20260223 172606.wav,यो इन्जेक्सन दिनदिनै लगाउनुपर्र्छ
3/20260223 172611.wav,बिल भुक्तानी काउन्टर नम्बर पाँचमा हुन्छ
3/20260223 172617.wav,रिपोर्ट इमेलमा पठाइदिन मिल्छ
3/20260223 172623.wav,मुटु रोग विशेषज्ञ कार्डियोलोजिस्टसँग सोध्नुपर्छ
3/20260223 172639.wav,घाउको ड्रेसिङ गर्नुपर्ने रहेछ
3/20260223 172646.wav,पानी उमालेर मात्र पिउनुहोला
3/20260223 172651.wav,तपाईँको स्वास्थ्यमा छिट्टै सुधार होस्
3/20260223 172656.wav,अस्पतालको नियम पालना गरिदिनुहोला
3/20260223 172701.wav,कुनै समस्या परे नर्सिङ स्टेसनमा भन्नुहोस्
3/20260223 172706.wav,धन्यवाद शीघ्र स्वास्थ्य लाभ को कामना
3/20260223 172732.wav,रिपोर्ट लिन बिहान दस बजे आउनुहोला
3/20260223 172737.wav,नमस्ते सेवामा समर्पित छौँ
3/20260223 172746.wav,नमस्कार बुद्ध यति नेपाल एयरलाइन्समा स्वागत छ
3/20260223 172754.wav,कृपया तपाईँको टिकट र परिचय पत्र आइडी कार्ड देखाउनुहोस्
3/20260223 172801.wav,काठमाडौँको उडान फ्लाइट कति बजे छ
3/20260223 172806.wav,तपाईँको ब्यागेटको तौल बढी भयो
3/20260223 172811.wav,मौसम खराबीले गर्दा उडान ढिला भएको छ
3/20260223 172818.wav,बोर्डिङ पास लिन लाइनमा आउनुहोस्
3/20260223 172826.wav,झ्यालको सिट विन््डो सिट खाली छ
3/20260223 172830.wav,सुरक्षा जाँच सेक्युरिटी चेकमा सहयोग गरिदिनुहोस्
3/20260223 172837.wav,ह्यान्ड क्यारीमा तरल पदार्थ लैजान पाइँदैन
3/20260223 172843.wav,कृपया आफ्नो सिटबेल्ट बाँध्नुहोला
3/20260223 172849.wav,पोखराको लागि अन्तिम कल फाइनल कल हुँदैछ
3/20260223 172855.wav,टिकट रद्द क्यान्सल गर्दा कति पैसा काटिन्छ
3/20260223 172902.wav,अन्तर्राष्ट्रिय उडानको लागि तीन घण्टा अगाडि आउनुहोस्
3/20260223 172908.wav,तपाईँको लगेट हराएको भए दाबी क्लेम गर्नुहोस्
3/20260223 172915.wav,आजको उडान रद्द क्यान्सल भएको जानकारी गराउँदैछौँ
3/20260223 172928.wav,भिसा र पासपोर्टको म्याद चेक गर्नुहोला
3/20260223 172933.wav,अनलाइन चेकइन गर्न मिल्छ
3/20260223 172938.wav,हजुरको सिट नम्बर एक दुई ए हो
3/20260223 172945.wav,ट्रान्जिटमा कति समय कुर्नुपर्छ
3/20260223 172950.wav,बिरामी यात्राको लागि हि व्लचेयर चाहिन्छ
3/20260223 172957.wav,बच्चाको लागि टिकटको आधा पैसा लाग्छ
3/20260223 173002.wav,कृपया मोबाइल फोन फ्लाइट मोडमा राख्नुहोस्
3/20260223 173008.wav,आगमन अराइभल र प्रस्थान डिपार्टर समय तालिका यहाँ छ
3/20260223 173948.wav,ड्युटी फ्री पसल कहाँ छ
3/20260223 173953.wav,तपाईँको नाममा टिकट फेला परेन
3/20260223 173958.wav,इमर्जेन्सी ढोका इमर्जेन्सी एक्जेट नजिक बस्न मान्नुहुन्छ
3/20260223 174005.wav,पाइलटले अवतरण ल्यान्डिङको घोषणा गर्दै हुनुहुन्छ
3/20260223 174015.wav,कृपया आफ्नो सामान आफै बोक्नुहोला
3/20260223 174028.wav,टिकटको मिति सार्नभिसक्याजुल मिल्छ
3/20260223 174042.wav,लाउन्ड सुविधा बिजनेस क्लासलाई मात्र छ
3/20260223 174054.wav,ब्यागेज ट्याग सुरक्षित राख्नुहोला
3/20260223 174059.wav,काउन्टर बन्द भइसक्यो अब चेकइन हुँदैन
3/20260223 174105.wav,रिफन्ड प्रक्रिया सात दिन लाग्छ
3/20260223 174110.wav,एयर होस्टेसलाई बोलाउनु परे घन्टी थिच्नुहोला
3/20260223 174116.wav,धुम्रपान गर्न पाइँदैन
3/20260223 174121.wav,तपाईँको जरान उडान कनेक्टिङ फ्लाइट छुट्न सक्छ
3/20260223 174133.wav,यो सिजनमा टिकट पाउन गाह्रो छ
3/20260223 174138.wav,समूहमा जाँदा छुट खुब डिस्काउन्ट हुन्छ
3/20260223 174144.wav,कृपया शान्त भएर यात्रा गर्नुहोला
3/20260223 174152.wav,शौचालय रेस्टरुम जहाजको पछाडि छ
3/20260223 174158.wav,लगेज बेल्ट लगेज बेल्ट नम्बर दुईमा आउँछ
3/20260223 174206.wav,हराएको सामान फाउन्ट लस्टन फाउन्ट शाखामा बुझ्नुनुस्
3/20260223 174223.wav,उडान समय एक घण्टा तीस मिनटको हुनेछ
3/20260223 174231.wav,टर्बुलेन्स हुँदा नआतिनुहोला
3/20260223 174236.wav,धन्यवाद शुभ यात्रा
3/20260223 174240.wav,फेरि भेटौला नमस्ते
3/20260223 174246.wav,तपाईँको यात्रा आरामदायी रहोस्
3/20260223 174250.wav,नेपालको सुन्दर दृश्य हेर्न नभुल्नुहोला
3/20260223 174256.wav,हजुरको सहयोगको लागि धन्यवाद
3/20260223 174318.wav,नमस्ते होटलको नाममा यहाँलाई स्वागत छ
3/20260223 174324.wav,के तपाईँले कोठा बुकिङ गर्नुभएको छ
3/20260223 174331.wav,आज हामीसँग डिलक स्ट्रिम खाली छ
3/20260223 174336.wav,खानाको मेन्यु यहाँ छ हेर्नुहोस्
3/20260223 174341.wav,हजुरलाई कफी कि चिया ल्याउ
3/20260223 174346.wav,चेकआउट गर्ने समय बाह्र बजे हो
3/20260223 174352.wav,कृपया रुम सर्भिसको लागि एक टायल गर्नुहोस्
3/20260223 174358.wav,तातो पानी चौबिस घण्टा आउँछ
3/20260223 174403.wav,खानापिरो कम बनाउन भन्नुहोला
3/20260223 174416.wav,यो हाम्रो विशेष परिकार स्पेसल डेेश हो
3/20260223 174428.wav,बिलमा दस प्रतिशत सेवा शुल्क सर्भिस चार्ज लाग्छ
3/20260223 174436.wav,वाइफाईको पासवर्ड रिसेप्सन डेस्कमा छ
3/20260223 174442.wav,हजुरको सामान खठासम्म पुर्याइदिन्छौँ
3/20260223 174447.wav,ब्रेकफास्ट बिहान सातदेखि दस बजेसम्म हुन्छ
3/20260223 174454.wav,स्विमिङ पुल प्रयोग गर्न सक्नुहुन्छ
3/20260223 174507.wav,आज राति लाइभ म्युजिक छ
3/20260223 174512.wav,कृपया परिचय पत्र आइडीको फोटोकपी दिनुहोस्
3/20260223 174522.wav,यो कोठाबाट हिमालको दृश्य राम्रो देखिन्छ
3/20260223 174529.wav,हजुरको टेबल रिजर्भ गरिएको छ
3/20260223 174535.wav,शाकाहारी भेजिटेरियन खाना पनि उपलब्ध छ
3/20260223 174540.wav,पार्टी हलको भाडा कति लाग्छ
3/20260223 174546.wav,कृपया साँचौ कि कार्ड सुरक्षित राख्नुहोला
3/20260223 174552.wav,हामी एयरपोर्ट जप सेवा दिन्छौँ
3/20260223 174557.wav,लन्ड्री सेवाको लागि ब्यागमा कपडा राख्नुहोस्
3/20260223 174604.wav,हजुरलाई बसाई कस्तो लाग्यो
3/20260223 174614.wav,अतिरिक्त ओछ्यान एक्स्ट्रा बेडको शुल्क लाग्छ
3/20260223 174620.wav,कृपया प्रतिक्रिया पुस्तिका फिडब्याक बुकमा लेखिदिनुहोला
3/20260223 174628.wav,एसीको रिमोट यहाँ छ
3/20260223 174632.wav,आजको स्पेसल थकाली खाना हो
3/20260223 174637.wav,वाइनको अर्डर गर्न चाहनुहुन्छ
3/20260223 174642.wav,बालबालिकाको लागि खेल्ने ठाउँ प्ले एरिया छ
3/20260223 174648.wav,जन्मदिनको के के हामी अर्डर गर्न सक्छौँ ह अर्डर
3/20260223 174715.wav,यो कोथाा सान्डप्रुफ हो
3/20260223 174720.wav,बिहानको वेकअप कल चाहिन्छ
3/20260223 174724.wav,मिनरल वाटरको पैसा छुट्टै लाग्छ
3/20260223 174730.wav,हामी अर्गानिक तरकारी प्रयोग गर्छौँ
3/20260223 174754.wav,जिम हल बिहान पाँच बजे खुल्छ
3/20260223 174803.wav,हजुरको बिल तयार भयो
3/20260223 174807.wav,कार्डबाट तिर्दा सजिलो हुन्छ
3/20260223 174813.wav,टिप् दिन अनिवार्य छैन
3/20260223 174817.wav,फेरि पाल्नुहोला है
3/20260223 174822.wav,पाहुनाको सत्कार हाम्रो धर्म हो
3/20260223 174828.wav,कुनै कुराको कमी भए भन्नुहोला
3/20260223 174833.wav,धन्यवाद शुभ रात्रि
3/20260223 174837.wav,नमस्ते हजुरको बसाइ सुखद रहोस्
3/20260223 174844.wav,हजुरलाई देख्दा खुसी लाग्यो
3/20260223 174857.wav,नमस्कार दराज पठाउ डेलिभरीबाट बोलेको
3/20260223 174903.wav,हजुरको अर्डर लिएर आएको छु
3/20260223 174907.wav,तपाईँको लोकेसन व्वााट्सएपमा पठाउनुहोस् न
3/20260223 174923.wav,सामानको पैसा डेलिभरी भएपछि क्याश अन डेलिभरी दिँदा हुन्छ
3/20260223 174929.wav,यो सामानको साइज मिलेन भने सात््न मिल्छ
3/20260223 174934.wav,सेलको बेला किन्दा सस्तो पर्छ
3/20260223 174939.wav,तपाईँको पार्सल बाटोमै छ
3/20260223 174943.wav,सामान ड्यामेज निस्कियो भने फिर्ता लिन्छौ
3/20260223 174949.wav,कृपया सामान खोलेर चेक गर्नुहोला
3/20260223 174955.wav,एज अ फ्री डेलिभरीको अफर छ
3/20260223 175000.wav,कुपन कोड प्रयोग गर्नुभयो
3/20260223 175005.wav,तपाईँको अर्डर कन्फर्म गर्न फोन गरेको
3/20260223 175015.wav,सामान स्टक आउट आउट अफ स्टक भएछ
3/20260223 175019.wav,रिफन्ड तपाईँको बैङ्क खातामा आउँछ
3/20260223 175025.wav,यो प्रडक्टको रिभ्यू राम्रो छ
3/20260223 175030.wav,कुन रङ कलरको जुत्ता अर्डर गर्नुभएको
3/20260223 175039.wav,तपाईँ घरमा हुनुहुन्छ कि अफिसमा
3/20260223 175043.wav,अर्डर ट्र्याक गर्न एप हेर्नुहोस्
3/20260223 175056.wav,पाँच हजारको सपिङ गर्दा उपहार पाइन्छ
3/20260223 175103.wav,एड टु कार्ड गरेर राख्नुहोस्
3/20260223 175108.wav,तपाईँको मोबाइल नम्बर स्विच अफ थियो
3/20260223 175113.wav,भोलि डेलिभरी गर्दा हुन्छ
3/20260223 175117.wav,यो आधिकारिक विक्रेता अफिसियल सेलर हो
3/20260223 175129.wav,सामान मन परेन भने सात दिनभित्र फिर्ता गर्नुहोस्
3/20260223 175137.wav,तपाईँको अर्डर नम्बर कति हो
3/20260223 175142.wav,विसलिस्टमा सेभ गर्नुहोला
3/20260223 175146.wav,भुक्तानी असफल पेमेन्ट फेल्ड भयो
3/20260223 175151.wav,वालेटबाट तिर्दा क्यासब्याक आउँछ
3/20260223 175157.wav,यो अफर इलेभेन इलेभेनमा मात्र हो
3/20260223 175204.wav,तपाईँको खाता भेरिफाई गर्नुहोस्
3/20260223 175210.wav,डेलिभरी चार्ज एक सय रुपियाँ लाग्छ
3/20260223 175219.wav,सामानको वारेन्टी कार्ड बक्साभित्र छ
3/20260223 175237.wav,कृपया पाँच स्टार रेटिङ दिनुहोला
3/20260223 175242.wav,फ्ल्यास सेल सुरु हुन लाग्यो
3/20260223 175247.wav,ग्रोसरी सामान आजै आउँछ
3/20260223 175251.wav,तपाईँको पुरानो फोन साटेर नयाँ लिनुहोस्
3/20260223 175304.wav,यो ल्यापटपको स्पेसिफिकेसन दिनुहोस्
3/20260223 175310.wav,गिफ्ट ऱयाप गरिदियो
3/20260223 175329.wav,तपाईँको ठेगाना प्रष्ट भएन
3/20260223 175334.wav,गेटमा आएर सामान लिनुहोस् न
3/20260223 175340.wav,खुद्रा पैसा चेन्ज छ कि छैन
3/20260223 175344.wav,स्क्यामबाट बच्न आधिकारिक एप चलाउनुहोस्
3/20260223 175350.wav,हेल्पलाइनमा सम्पर्क गर्नुहोस्
3/20260223 175354.wav,अर्डर क्यान्सल किन गर्नुभयो
3/20260223 175359.wav,तपाईँको सपिङ अनुभव कस्तो रह्यो
3/20260223 175404.wav,हामी नेपालभर डेलिभरी गर्छौँ ए
3/20260223 175415.wav,धन्यवाद फेरि अर्डर गर्नुहोला
3/20260223 175427.wav,नमस्ते हजुरको दिन शुभ रहोस्
3/20260223 175433.wav,सुरक्षित अनलाइन सपिङ गर्नुहोस्
3/20260223 175438.wav,हजुरको विश्वास हाम्रो दायित्व
4/20260227 122031.wav,हजुरको खातामा मोबाइल नम्बर लिङ्क गरिएको छैन
4/20260227 122127.wav,चेकबुक हराएको निवेदन दिन तीन नम्बर काउन्टरमा जानुहोस्
4/20260227 122142.wav,तपाईँको हस्ताक्षर पुरानो रेकर्डसँग मेल भएन
4/20260227 122148.wav,यो एटिएम मसिनबाट पाँच सयको नोट मात्र आउँछ
4/20260227 122156.wav,हजुरको खाता फ्रिज भएको छ फुकुवा गर्नुपर्छ
4/20260227 122202.wav,बैङ्कको मोबाइल एप अपडेट गर्नुभयो
4/20260227 122208.wav,केवाइसी फारम भर्नु अनिवार्य छ
4/20260227 122214.wav,आज काउन्टर दुई बजेसम्म मात्र खुल्ला हुन्छ
4/20260227 122219.wav,तपाईँको मुथती खाता फिक्स्ड डिपोजिटको म्याच सकियो
4/20260227 122226.wav,कृपया टोकन नम्बर लिएर पालो पर्खनुहोस्
4/20260227 122233.wav,ब्याङ्क ग्यारेन्टीको कमिसन कति लाग्छ
4/20260227 122239.wav,तपाईँको खातामा दस लाखभन्दा बढी जम्मा हुँदैछ
4/20260227 122246.wav,चेकपााउन्स भएमा कालो सूचीमा पर्न सकिन्छ
4/20260227 122302.wav,नयाँ ब्याजदर इन्ट्रेस्ट रेट भोलिदेखि लागु हुन्छ
4/20260227 122308.wav,तपाईँको डेबिट कार्डको पिन बिर्सिनुभयो
4/20260227 122316.wav,अनलाइनबाटै डिम्याट रिन्यू गर्न मिल्छ
4/20260227 122322.wav,रेमिटेन्सको पैसा लिन परिचय पत्र लिएर आउनुहोस्
4/20260227 122328.wav,तपाईँको लोनको किस्ता तिर्ने समय नाघ्यो
4/20260227 122335.wav,ब्याङ्क स्टेटमेन्टमा छाप लगाउनुपर्र्छ
4/20260227 122340.wav,कृपया काउन्टरमा भिडभाड नगरी लाइनमा बस्नुहोस्
4/20260227 122345.wav,तपाईँको सिआरएन नम्बर दर्ता भएको छैन
4/20260227 122351.wav,सुन कर्जाको लागि भ्याल्युएटर आउँदै हुनुहुन्छ
4/20260227 122359.wav,डलर कार्ड लिन प्यान कार्ड चाहिन्छ
4/20260227 122403.wav,यो महिनाको ब्याज घर इन्ट्रेस्ट ट्याक्स काटिएको छ
4/20260227 122412.wav,तपाईँको खाता आजै एक्टिभेट हुन्छ
4/20260227 122426.wav,कृपया बैङ्कभित्र टोपी र चस्मा फुकाल्नुहोला
4/20260227 122440.wav,मोबाइल ब्याङ्किङको पासवर्ड कसैलाई पनि नदिनुहोला
4/20260227 122446.wav,चेकमा मिति डेट लेख्दा गल्ती भएछ
4/20260227 122451.wav,तपाईँको खाता माइनरदेखि मेजरमा सार्नुपर्छ
4/20260227 122457.wav,पचास हजारभन्दा माथिको चेक साट्न म्यानेजरको सही चाहिन्छ
4/20260227 122634.wav,कनेक्ट आइपिएसको भेरिफाई गर्न आउनुभएको
4/20260227 122640.wav,तपाईँको नागरिकताको प्रतिलिपि फोटोकपी प्रष्ट छैन
4/20260227 122647.wav,यो योजनामा नि शुल्क बिमा इन्सुरेन्स सुविधा छ
4/20260227 122654.wav,तपाईँको समस्या समाधान गर्न आइटी शाखामा सोध्नुपर्छ
4/20260227 122702.wav,विदेशबाट पैसा पठाउन स्विफ्ट कोट चाहिन्छ
4/20260227 123014.wav,एज अ सिस्टम अलि ढिलो चलिरहेको छ
4/20260227 123019.wav,तपाईँको चेक क्लियरिङ हाउसमा पुगेको छ
4/20260227 123025.wav,एटिएम कार्ड मसिनले निलेन भने खबर गर्नुहोला
4/20260227 141502.wav,तपाईँको इमेल ठेगाना इमेल एड्रेस अपडेट गरिदियो
4/20260227 141508.wav,संयुक्त खाता जोइन्ट अकाउन्ट खोल्न दुबैजान आउनुपर्छ
4/20260227 141515.wav,यो शाखा शनिबार पनि खुल्छ
4/20260227 141519.wav,तपाईँको पेन्सन पट्टा पेन्सन बुक नवीकरण भएको छैन
4/20260227 141525.wav,लकर सुविधा लिन धरौटी राख्नुपर्छ
4/20260227 141534.wav,कृपया भाउचरमा जम्मा गर्नेको नाम लेख्नुहोस्
4/20260227 141541.wav,तपाईँको खातामा पर्याप्त ब्यालेन्स छैन
4/20260227 141547.wav,शैक्षिक कर्जाको लागि कलेजको सिफारिस पत्र चाहिन्छ
4/20260227 141554.wav,तपाईँको हस्ताक्षर अङ्ग्रेजीमा छ कि नेपालीमा
4/20260227 141559.wav,मेरो सेयरको फर्म यहाँ पाइन्छ
4/20260227 141604.wav,कृपया वृद्ध वृद्ध र अशक्तलाई प्राथमिकता दिनुहोला
4/20260227 141646.wav,तपाईँको चेक अकाउन्ट पेयी मात्र हुन्छ
